Full Name,Title,Company,Email,LinkedIn URL,Website,Location,Investment Thesis,Focus Sectors,Focus Stages,Focus Geographies,Check Size Min,Check Size Max,Portfolio Companies,Bio
Jessica Thompson,Partner,Sequoia Capital,jessica@sequoiacap.com,https://linkedin.com/in/jessicathompson,https://sequoiacap.com,San Francisco,"Investing in category-defining companies that leverage AI and data to transform traditional industries. Looking for 10x potential with strong product-market fit.","AI/ML,SaaS,FinTech","Seed,Series A","North America,Europe",$500000,$5000000,45,"15+ years in venture capital. Previously founded 2 startups (1 exit). Stanford MBA. Passionate about AI-first companies."
Robert Chen,Managing Director,Andreessen Horowitz,robert@a16z.com,https://linkedin.com/in/robertchen,https://a16z.com,Menlo Park,"Backing bold founders building the future of enterprise software. Focus on B2B SaaS with strong unit economics and viral growth.","SaaS,Enterprise,DevTools","Series A,Series B","Global",$3000000,$15000000,32,"Former CTO at Salesforce. 20 years in enterprise software. MIT Computer Science. Board member at 8 companies."
Maria Rodriguez,Principal,Accel Partners,maria@accel.com,https://linkedin.com/in/mariarodriguez,https://accel.com,Palo Alto,"Early-stage investor in consumer and marketplace businesses. Love products that create delightful user experiences and network effects.","Consumer,Marketplace,E-commerce","Pre-seed,Seed","North America,Latin America",$250000,$3000000,28,"Ex-Product Lead at Airbnb. Harvard Business School. Focus on consumer behavior and growth strategies."
James Wilson,General Partner,Benchmark Capital,james@benchmark.com,https://linkedin.com/in/jameswilson,https://benchmark.com,San Francisco,"Investing in transformative technology companies at the earliest stages. Thesis-driven approach focused on platform shifts.","Infrastructure,Developer Tools,Open Source","Seed,Series A","Global",$1000000,$10000000,18,"Serial entrepreneur (3 exits). Angel investor in 50+ startups. Berkeley Engineering. Open source advocate."
Lisa Park,Venture Partner,Greylock Partners,lisa@greylock.com,https://linkedin.com/in/lisapark,https://greylock.com,Boston,"Backing mission-driven founders solving hard problems in healthcare and life sciences. Deep tech + social impact.","HealthTech,BioTech,Life Sciences","Seed,Series A,Series B","North America,Asia",$2000000,$12000000,22,"MD from Johns Hopkins. Former healthcare exec at Johnson & Johnson. Advisor to WHO on digital health initiatives."
